id,link,headline,category,short_description,authors,date
80,https://www.huffingtonpost.com/entry/parents-target-psychology_us_5aa7fba3e4b0e872b4bf5244,There Are Psychological Reasons Parents Are So Obsessed With Target,BUSINESS,"Marketing experts, therapists and parents weigh in.",Caroline Bologna,1522281600
81,https://www.huffingtonpost.com/entry/walmart-removing-cosmo-from-checkout_us_5abad5bde4b06409775b0d9f,Walmart Partners With Conservative Group To Remove Cosmo From Checkout Lines,BUSINESS,"“The real world took another step toward its slow and sure conversion to The Handmaid’s Tale this week,” a Vogue editor responded.",Rebecca Shapiro,1522195200
82,https://www.huffingtonpost.com/entry/uber-halt-self-driving-cars-california_us_5abaa6ede4b03e2a5c7704ad,"Uber Halts Self-Driving Car Tests In California, Where It Didn't Test Much Anyway",BUSINESS,The consequences of a fatal crash in Arizona continue.,Ryan Grenoble,1522108800
83,https://www.huffingtonpost.com/entry/remington-arms-chapter-11-bankruptcy_us_5ab85907e4b0decad04b57b6,Remington Files For Chapter 11 Bankruptcy Amid Mounting Pressure For More Gun Control,BUSINESS,The company listed assets in the range of $500 million to $1 billion and liabilities in the range of $500 million and $1 billion.,"Tom Hais, Reuters",1522022400
84,https://www.huffingtonpost.com/entry/errol-musk-elon-musk-stepdaughter_us_5ab9113ee4b0decad04c68c3,"Elon Musk's Estranged Father Has Child With Stepdaughter, Says It's 'God's Plan'",BUSINESS,The young woman was only 4 years old when Errol Musk married her mother.,Jenna Amatulli,1522022400
85,https://www.huffingtonpost.com/entry/youtube-gun-videos-restrictions-policies_us_5ab36780e4b0decad046cb83,YouTube Quietly Escalates Crackdown On Firearm Videos,BUSINESS,The video site is expanding restrictions following the Florida massacre.,Dominique Mosbergen,1521676800
